{
  "schemaVersion": 1,
  "name": "ten-domain-connectivity-test",
  "url": "https://example.com",
  "browser": "chromium",
  "headless": true,
  "timeoutMs": 45000,
  "retries": 1,
  "retryDelayMs": 700,
  "allowSideEffects": false,
  "allowPrivateNetwork": false,
  "outputDir": "scripts/playwright-output",
  "output": { "format": "json" },
  "actions": [
    { "type": "evaluate", "as": "domain_01", "fn": "() => ({ url: location.href, title: document.title, h1: document.querySelector('h1')?.innerText?.trim() || null })" },

    { "type": "goto", "url": "https://www.wikipedia.org", "waitUntil": "domcontentloaded" },
    { "type": "evaluate", "as": "domain_02", "fn": "() => ({ url: location.href, title: document.title, h1: document.querySelector('h1')?.innerText?.trim() || null })" },

    { "type": "goto", "url": "https://www.mozilla.org", "waitUntil": "domcontentloaded" },
    { "type": "evaluate", "as": "domain_03", "fn": "() => ({ url: location.href, title: document.title, h1: document.querySelector('h1')?.innerText?.trim() || null })" },

    { "type": "goto", "url": "https://www.python.org", "waitUntil": "domcontentloaded" },
    { "type": "evaluate", "as": "domain_04", "fn": "() => ({ url: location.href, title: document.title, h1: document.querySelector('h1')?.innerText?.trim() || null })" },

    { "type": "goto", "url": "https://github.com", "waitUntil": "domcontentloaded" },
    { "type": "evaluate", "as": "domain_05", "fn": "() => ({ url: location.href, title: document.title, h1: document.querySelector('h1')?.innerText?.trim() || null })" },

    { "type": "goto", "url": "https://www.npmjs.com", "waitUntil": "domcontentloaded" },
    { "type": "evaluate", "as": "domain_06", "fn": "() => ({ url: location.href, title: document.title, h1: document.querySelector('h1')?.innerText?.trim() || null })" },

    { "type": "goto", "url": "https://openai.com", "waitUntil": "domcontentloaded" },
    { "type": "evaluate", "as": "domain_07", "fn": "() => ({ url: location.href, title: document.title, h1: document.querySelector('h1')?.innerText?.trim() || null })" },

    { "type": "goto", "url": "https://www.bbc.com", "waitUntil": "domcontentloaded" },
    { "type": "evaluate", "as": "domain_08", "fn": "() => ({ url: location.href, title: document.title, h1: document.querySelector('h1')?.innerText?.trim() || null })" },

    { "type": "goto", "url": "https://www.w3.org", "waitUntil": "domcontentloaded" },
    { "type": "evaluate", "as": "domain_09", "fn": "() => ({ url: location.href, title: document.title, h1: document.querySelector('h1')?.innerText?.trim() || null })" },

    { "type": "goto", "url": "https://www.cloudflare.com", "waitUntil": "domcontentloaded" },
    { "type": "evaluate", "as": "domain_10", "fn": "() => ({ url: location.href, title: document.title, h1: document.querySelector('h1')?.innerText?.trim() || null })" }
  ]
}
